id,hasTranslation,surah_ayah,surah_no,ayah_no,hasBroadCategories,hasScientificTopics,hasContextualReference,hasScientificConceptID,hasScientificTafsirTopics,hasScientificNodes,hasTafsirID,hasThemes,hasText
1,"Or ˹those caught in˺ a rainstorm from the sky with darkness, thunder, and lightning. They press their fingers into their ears at the sound of every thunder-clap for fear of death. And Allah encompasses the disbelievers ˹by His might˺.",2:19,2,19,"[""geological""]","[""hydrology_water_cycle"",""atmospheric_phenomena""]",,"[""HYDRO_METEO""]",[“Light Thunder Darkness”],"[""HYDRO_METEO_13"",""HYDRO_METEO_14"",""HYDRO_METEO_07"",""HYDRO_METEO_15""]",TAAK_1_2_19,"[""parable"",""historical_event""]",أَوْ كَصَيِّبٍۢ مِّنَ ٱلسَّمَآءِ فِيهِ ظُلُمَٰتٌۭ وَرَعْدٌۭ وَبَرْقٌۭ يَجْعَلُونَ أَصَٰبِعَهُمْ فِىٓ ءَاذَانِهِم مِّنَ ٱلصَّوَٰعِقِ حَذَرَ ٱلْمَوْتِ ۚ وَٱللَّهُ مُحِيطٌۢ بِٱلْكَٰفِرِينَ
2,"˹He is the One˺ Who has made the earth a place of settlement for you and the sky a canopy; and sends down rain from the sky, causing fruits to grow as a provision for you. So do not knowingly set up equals to Allah ˹in worship˺.",2:22,2,22,"[""geological""]","[""hydrology_water_cycle""]",,"[""HYDRO_METEO""]",[“Terrestrial & Hydrological Cycle”],"[""HYDRO_METEO_04"",""HYDRO_METEO_10""]",TAAK_1_2_22,"[""process""]",ٱلَّذِى جَعَلَ لَكُمُ ٱلْأَرْضَ فِرَٰشًۭا وَٱلسَّمَآءَ بِنَآءًۭ وَأَنزَلَ مِنَ ٱلسَّمَآءِ مَآءًۭ فَأَخْرَجَ بِهِۦ مِنَ ٱلثَّمَرَٰتِ رِزْقًۭا لَّكُمْ ۖ فَلَا تَجْعَلُوا۟ لِلَّهِ أَندَادًۭا وَأَنتُمْ تَعْلَمُونَ
3,"Surely Allah does not shy away from using the parable of a mosquito or what is even smaller. As for the believers, they know that it is the truth from their Lord. And as for the disbelievers, they argue, “What does Allah mean by such a parable?” Through this ˹test˺, He leaves many to stray, and guides many. And He leaves none to stray except the rebellious—",2:26,2,26,"[""biological""]","[""animal_behavior_ecosystems""]",,,"[“Micro-Complexity”, “biological structure of mosquito”]",,TAAK_1_2_26,"[""analogical"",""ethical_theological""]",۞ إِنَّ ٱللَّهَ لَا يَسْتَحْىِۦٓ أَن يَضْرِبَ مَثَلًۭا مَّا بَعُوضَةًۭ فَمَا فَوْقَهَا ۚ فَأَمَّا ٱلَّذِينَ ءَامَنُوا۟ فَيَعْلَمُونَ أَنَّهُ ٱلْحَقُّ مِن رَّبِّهِمْ ۖ وَأَمَّا ٱلَّذِينَ كَفَرُوا۟ فَيَقُولُونَ مَاذَآ أَرَادَ ٱللَّهُ بِهَٰذَا مَثَلًۭا ۘ يُضِلُّ بِهِۦ كَثِيرًۭا وَيَهْدِى بِهِۦ كَثِيرًۭا ۚ وَمَا يُضِلُّ بِهِۦٓ إِلَّا ٱلْفَٰسِقِينَ
4,"He is the One Who created everything in the earth for you. Then He turned towards the heaven, forming it into seven heavens. And He has ˹perfect˺ knowledge of all things.",2:29,2,29,"[""cosmological""]","[""heavens_chracteristics""]",,,[“Cosmogony”],,TAAK_1_2_29,"[""creation_story"",""process""]",هُوَ ٱلَّذِى خَلَقَ لَكُم مَّا فِى ٱلْأَرْضِ جَمِيعًۭا ثُمَّ ٱسْتَوَىٰٓ إِلَى ٱلسَّمَآءِ فَسَوَّىٰهُنَّ سَبْعَ سَمَٰوَٰتٍۢ ۚ وَهُوَ بِكُلِّ شَىْءٍ عَلِيمٌۭ
5,"And ˹remember when˺ We shaded you with clouds and sent down to you manna and quails, ˹saying˺, “Eat from the good things We have provided for you.” The evildoers ˹certainly˺ did not wrong Us, but wronged themselves.",2:57,2,57,"[""non_scientific""]","[""historical_event""]",,,[“biological benefits of Manna and Quails”],,TAAK_1_2_57,"[""historical_event"",""material_substance_reference""]",وَظَلَّلْنَا عَلَيْكُمُ ٱلْغَمَامَ وَأَنزَلْنَا عَلَيْكُمُ ٱلْمَنَّ وَٱلسَّلْوَىٰ ۖ كُلُوا۟ مِن طَيِّبَٰتِ مَا رَزَقْنَٰكُمْ ۖ وَمَا ظَلَمُونَا وَلَٰكِن كَانُوٓا۟ أَنفُسَهُمْ يَظْلِمُونَ
6,"Even then your hearts became hardened like a rock or even harder, for some rocks gush rivers; others split, spilling water; while others are humbled in awe of Allah. And Allah is never unaware of what you do.",2:74,2,74,"[""geological""]","[""landforms""]",,,"[""Water related stone characteristics""]",,TAAK_1_2_74,"[""analogical"",""ethical_theological"",""material_substance_reference""]",ثُمَّ قَسَتْ قُلُوبُكُم مِّنۢ بَعْدِ ذَٰلِكَ فَهِىَ كَٱلْحِجَارَةِ أَوْ أَشَدُّ قَسْوَةًۭ ۚ وَإِنَّ مِنَ ٱلْحِجَارَةِ لَمَا يَتَفَجَّرُ مِنْهُ ٱلْأَنْهَٰرُ ۚ وَإِنَّ مِنْهَا لَمَا يَشَّقَّقُ فَيَخْرُجُ مِنْهُ ٱلْمَآءُ ۚ وَإِنَّ مِنْهَا لَمَا يَهْبِطُ مِنْ خَشْيَةِ ٱللَّهِ ۗ وَمَا ٱللَّهُ بِغَٰفِلٍ عَمَّا تَعْمَلُونَ
7,"They ask you ˹O Prophet˺ about menstruation. Say, “Beware of its harm! So keep away, and do not have intercourse with your wives during their monthly cycles until they are purified. When they purify themselves, then you may approach them in the manner specified by Allah. Surely Allah loves those who always turn to Him in repentance and those who purify themselves.”",2:222,2,222,"[""biological""]","[""health""]",,,"[""Affirmation of Menstrual Harm""]",,TAAK_1_2_222,"[""prophetic_scientific""]",وَيَسْـَٔلُونَكَ عَنِ ٱلْمَحِيضِ ۖ قُلْ هُوَ أَذًۭى فَٱعْتَزِلُوا۟ ٱلنِّسَآءَ فِى ٱلْمَحِيضِ ۖ وَلَا تَقْرَبُوهُنَّ حَتَّىٰ يَطْهُرْنَ ۖ فَإِذَا تَطَهَّرْنَ فَأْتُوهُنَّ مِنْ حَيْثُ أَمَرَكُمُ ٱللَّهُ ۚ إِنَّ ٱللَّهَ يُحِبُّ ٱلتَّوَّٰبِينَ وَيُحِبُّ ٱلْمُتَطَهِّرِينَ
8,"And the example of those who donate their wealth, seeking Allah’s pleasure and believing the reward is certain, is that of a garden on a fertile hill: when heavy rain falls, it yields up twice its normal produce. If no heavy rain falls, a drizzle is sufficient. And Allah is All-Seeing of what you do.",2:265,2,265,"[""biological"",""geological""]","[""animal_behavior_ecosystems"",""landforms""]",,,,,TAAK_1_2_265,"[""phenomena"",""biological_diversity"",""analogical""]",وَمَثَلُ ٱلَّذِينَ يُنفِقُونَ أَمْوَٰلَهُمُ ٱبْتِغَآءَ مَرْضَاتِ ٱللَّهِ وَتَثْبِيتًۭا مِّنْ أَنفُسِهِمْ كَمَثَلِ جَنَّةٍۭ بِرَبْوَةٍ أَصَابَهَا وَابِلٌۭ فَـَٔاتَتْ أُكُلَهَا ضِعْفَيْنِ فَإِن لَّمْ يُصِبْهَا وَابِلٌۭ فَطَلٌّۭ ۗ وَٱللَّهُ بِمَا تَعْمَلُونَ بَصِيرٌ
9,"He is the One Who shapes you in the wombs of your mothers as He wills. There is no god ˹worthy of worship˺ except Him—the Almighty, All-Wise.",3:6,3,6,"[""biological""]","[""embryology_development""]",,"[""EMBRYO""]",,,TAAK_1_3_6,"[""process"",""prophetic_scientific""]",هُوَ ٱلَّذِى يُصَوِّرُكُمْ فِى ٱلْأَرْحَامِ كَيْفَ يَشَآءُ ۚ لَآ إِلَٰهَ إِلَّا هُوَ ٱلْعَزِيزُ ٱلْحَكِيمُ
10,"Indeed, the example of Jesus in the sight of Allah is like that of Adam. He created him from dust, then said to him, “Be!” And he was!",3:59,3,59,"[""biological""]","[""human_development""]",,,"[""Human Body Composition align with earth""]",,TAAK_1_3_59,"[""creation_story"",""analogical"",""historical_event""]",إِنَّ مَثَلَ عِيسَىٰ عِندَ ٱللَّهِ كَمَثَلِ ءَادَمَ ۖ خَلَقَهُۥ مِن تُرَابٍۢ ثُمَّ قَالَ لَهُۥ كُن فَيَكُونُ
11,"In it are clear signs and the standing-place of Abraham. Whoever enters it should be safe. Pilgrimage to this House is an obligation by Allah upon whoever is able among the people. And whoever disbelieves, then surely Allah is not in need of ˹any of His˺ creation.",3:97,3,97,"[""non_scientific""]","[""thinking_reflecting""]",,,"[""Sensory evidence of noble mosque""]",,TAAK_1_3_97,"[""signs_to_reflect_upon"",""historical_event"",""ethical_theological"",""knowledge_understanding""]",فِيهِ ءَايَٰتٌۢ بَيِّنَٰتٌۭ مَّقَامُ إِبْرَٰهِيمَ ۖ وَمَن دَخَلَهُۥ كَانَ ءَامِنًۭا ۗ وَلِلَّهِ عَلَى ٱلنَّاسِ حِجُّ ٱلْبَيْتِ مَنِ ٱسْتَطَاعَ إِلَيْهِ سَبِيلًۭا ۚ وَمَن كَفَرَ فَإِنَّ ٱللَّهَ غَنِىٌّ عَنِ ٱلْعَٰلَمِينَ
12,"O humanity! Be mindful of your Lord Who created you from a single soul, and from it He created its mate, and through both He spread countless men and women. And be mindful of Allah—in Whose Name you appeal to one another—and ˹honour˺ family ties. Surely Allah is ever Watchful over you.",4:1,4,1,"[""biological""]","[""human_development"",""reproduction_heredity"",""creation_in_pairs""]",,,"[""Creation from one soul""]",,TAAK_1_4_1,"[""creation_story""]",يَٰٓأَيُّهَا ٱلنَّاسُ ٱتَّقُوا۟ رَبَّكُمُ ٱلَّذِى خَلَقَكُم مِّن نَّفْسٍۢ وَٰحِدَةٍۢ وَخَلَقَ مِنْهَا زَوْجَهَا وَبَثَّ مِنْهُمَا رِجَالًۭا كَثِيرًۭا وَنِسَآءًۭ ۚ وَٱتَّقُوا۟ ٱللَّهَ ٱلَّذِى تَسَآءَلُونَ بِهِۦ وَٱلْأَرْحَامَ ۚ إِنَّ ٱللَّهَ كَانَ عَلَيْكُمْ رَقِيبًۭا
13,"Surely those who reject Our signs, We will cast them into the Fire. Whenever their skin is burnt completely, We will replace it so they will ˹constantly˺ taste the punishment. Indeed, Allah is Almighty, All-Wise.",4:56,4,56,"[""biological""]","[""physiology""]",,,"[""Skin role in pain"",""Skin role in protection""]",,TAAK_1_4_56,"[""phenomena"",""prophetic_scientific""]",إِنَّ ٱلَّذِينَ كَفَرُوا۟ بِـَٔايَٰتِنَا سَوْفَ نُصْلِيهِمْ نَارًۭا كُلَّمَا نَضِجَتْ جُلُودُهُم بَدَّلْنَٰهُمْ جُلُودًا غَيْرَهَا لِيَذُوقُوا۟ ٱلْعَذَابَ ۗ إِنَّ ٱللَّهَ كَانَ عَزِيزًا حَكِيمًۭا
14,"I will certainly mislead them and delude them with empty hopes. Also, I will order them and they will slit the ears of cattle and alter Allah’s creation.” And whoever takes Satan as a guardian instead of Allah has certainly suffered a tremendous loss.",4:119,4,119,"[""biological""]","[""health"",""reproduction_heredity""]",,,,,TAAK_1_4_119,"[""biological_diversity"",""prophetic_scientific"",""ethical_theological""]",وَلَأُضِلَّنَّهُمْ وَلَأُمَنِّيَنَّهُمْ وَلَءَامُرَنَّهُمْ فَلَيُبَتِّكُنَّ ءَاذَانَ ٱلْأَنْعَٰمِ وَلَءَامُرَنَّهُمْ فَلَيُغَيِّرُنَّ خَلْقَ ٱللَّهِ ۚ وَمَن يَتَّخِذِ ٱلشَّيْطَٰنَ وَلِيًّۭا مِّن دُونِ ٱللَّهِ فَقَدْ خَسِرَ خُسْرَانًۭا مُّبِينًۭا
15,"Indeed, those who say, “Allah is the Messiah, son of Mary,” have fallen into disbelief. Say, ˹O Prophet,˺ “Who has the power to prevent Allah if He chose to destroy the Messiah, son of Mary, his mother, and everyone in the world all together?” To Allah ˹alone˺ belongs the kingdom of the heavens and the earth and everything in between. He creates whatever He wills. And Allah is Most Capable of everything.",5:17,5,17,"[""geological"",""physical"",""cosmological""]","[""atmospheric_phenomena"",""time_related"",""space_earth_interaction""]",,,,,TAAK_1_5_17,"[""phenomena"",""prophetic_scientific"",""ethical_theological""]",لَّقَدْ كَفَرَ ٱلَّذِينَ قَالُوٓا۟ إِنَّ ٱللَّهَ هُوَ ٱلْمَسِيحُ ٱبْنُ مَرْيَمَ ۚ قُلْ فَمَن يَمْلِكُ مِنَ ٱللَّهِ شَيْـًٔا إِنْ أَرَادَ أَن يُهْلِكَ ٱلْمَسِيحَ ٱبْنَ مَرْيَمَ وَأُمَّهُۥ وَمَن فِى ٱلْأَرْضِ جَمِيعًۭا ۗ وَلِلَّهِ مُلْكُ ٱلسَّمَٰوَٰتِ وَٱلْأَرْضِ وَمَا بَيْنَهُمَا ۚ يَخْلُقُ مَا يَشَآءُ ۚ وَٱللَّهُ عَلَىٰ كُلِّ شَىْءٍۢ قَدِيرٌۭ
16,"Then Allah sent a crow digging ˹a grave˺ in the ground ˹for a dead crow˺, in order to show him how to bury the corpse of his brother. He cried, “Alas! Have I ˹even˺ failed to be like this crow and bury the corpse of my brother?” So he became regretful.",5:31,5,31,"[""biological""]","[""animal_behavior_ecosystems""]",,,,,TAAK_1_5_31,"[""prophetic_scientific"",""historical_event"",""knowledge_understanding""]",فَبَعَثَ ٱللَّهُ غُرَابًۭا يَبْحَثُ فِى ٱلْأَرْضِ لِيُرِيَهُۥ كَيْفَ يُوَٰرِى سَوْءَةَ أَخِيهِ ۚ قَالَ يَٰوَيْلَتَىٰٓ أَعَجَزْتُ أَنْ أَكُونَ مِثْلَ هَٰذَا ٱلْغُرَابِ فَأُوَٰرِىَ سَوْءَةَ أَخِى ۖ فَأَصْبَحَ مِنَ ٱلنَّٰدِمِينَ
17,All praise is for Allah Who created the heavens and the earth and made darkness and light. Yet the disbelievers set up equals to their Lord ˹in worship˺.,6:1,6,1,"[""physical"",""cosmological""]","[""light_and_darkness"",""cosmology_universe"",""big_bang"",""universe_expansion""]",,,,,TAAK_1_6_1,"[""creation_story"",""process"",""prophetic_scientific""]",ٱلْحَمْدُ لِلَّهِ ٱلَّذِى خَلَقَ ٱلسَّمَٰوَٰتِ وَٱلْأَرْضَ وَجَعَلَ ٱلظُّلُمَٰتِ وَٱلنُّورَ ۖ ثُمَّ ٱلَّذِينَ كَفَرُوا۟ بِرَبِّهِمْ يَعْدِلُونَ
18,All living beings roaming the earth and winged birds soaring in the sky are communities like yourselves. Then to their Lord they will be gathered all together.,6:38,6,38,"[""biological""]","[""animal_behavior_ecosystems"",""reproduction_heredity""]",,,"[""Creation of all forms from single father and mother""]",,TAAK_1_6_38,"[""signs_to_reflect_upon"",""phenomena"",""biological_diversity""]",وَمَا مِن دَآبَّةٍۢ فِى ٱلْأَرْضِ وَلَا طَٰٓئِرٍۢ يَطِيرُ بِجَنَاحَيْهِ إِلَّآ أُمَمٌ أَمْثَالُكُم ۚ مَّا فَرَّطْنَا فِى ٱلْكِتَٰبِ مِن شَىْءٍۢ ۚ ثُمَّ إِلَىٰ رَبِّهِمْ يُحْشَرُونَ
19,This is a blessed Book which We have revealed—confirming what came before it—so you may warn the Mother of Cities and everyone around it. Those who believe in the Hereafter ˹truly˺ believe in it and guard their prayers.,6:92,6,92,"[""geological"",""order_and_design""]","[""landforms"",""qadar""]",,,,,TAAK_1_6_92,"[""prophetic_scientific"",""ethical_theological""]",وَهَٰذَا كِتَٰبٌ أَنزَلْنَٰهُ مُبَارَكٌۭ مُّصَدِّقُ ٱلَّذِى بَيْنَ يَدَيْهِ وَلِتُنذِرَ أُمَّ ٱلْقُرَىٰ وَمَنْ حَوْلَهَا ۚ وَٱلَّذِينَ يُؤْمِنُونَ بِٱلْءَاخِرَةِ يُؤْمِنُونَ بِهِۦ ۖ وَهُمْ عَلَىٰ صَلَاتِهِمْ يُحَافِظُونَ
20,"Indeed, Allah is the One Who causes seeds and fruit stones to sprout. He brings forth the living from the dead and the dead from the living. That is Allah! How can you then be deluded ˹from the truth˺?",6:95,6,95,"[""biological""]","[""plant_life_agriculture""]",,,"[""Germination of Plants"",""Hubb and Nawa""]",,TAAK_1_6_95,"[""process"",""prophetic_scientific""]",۞ إِنَّ ٱللَّهَ فَالِقُ ٱلْحَبِّ وَٱلنَّوَىٰ ۖ يُخْرِجُ ٱلْحَىَّ مِنَ ٱلْمَيِّتِ وَمُخْرِجُ ٱلْمَيِّتِ مِنَ ٱلْحَىِّ ۚ ذَٰلِكُمُ ٱللَّهُ ۖ فَأَنَّىٰ تُؤْفَكُونَ
21,"He causes the dawn to break, and has made the night for rest and ˹made˺ the sun and the moon ˹to travel˺ with precision. That is the design of the Almighty, All-Knowing.",6:96,6,96,"[""physical"",""cosmological"",""order_and_design""]","[""time_related"",""astronomy_celestial"",""day_night_cycles"",""qadar""]",,,,,TAAK_1_6_96,"[""signs_to_reflect_upon"",""process"",""prophetic_scientific"",""knowledge_understanding"",""rotation_of_bodies""]",فَالِقُ ٱلْإِصْبَاحِ وَجَعَلَ ٱلَّيْلَ سَكَنًۭا وَٱلشَّمْسَ وَٱلْقَمَرَ حُسْبَانًۭا ۚ ذَٰلِكَ تَقْدِيرُ ٱلْعَزِيزِ ٱلْعَلِيمِ
22,"And He is the One Who sends down rain from the sky—causing all kinds of plants to grow—producing green stalks from which We bring forth clustered grain. And from palm trees come clusters of dates hanging within reach. ˹There are˺ also gardens of grapevines, olives, and pomegranates, similar ˹in shape˺ but dissimilar ˹in taste˺. Look at their fruit as it yields and ripens! Indeed, in these are signs for people who believe.",6:99,6,99,"[""biological"",""geological""]","[""plant_life_agriculture"",""hydrology_water_cycle"",""atmospheric_phenomena""]",,"[""HYDRO_METEO""]","[""date palms"",""grapes"",""pomegranates"",""olives""]","[""HYDRO_METEO_10""]",TAAK_1_6_99,"[""process"",""biological_diversity"",""prophetic_scientific""]",وَهُوَ ٱلَّذِىٓ أَنزَلَ مِنَ ٱلسَّمَآءِ مَآءًۭ فَأَخْرَجْنَا بِهِۦ نَبَاتَ كُلِّ شَىْءٍۢ فَأَخْرَجْنَا مِنْهُ خَضِرًۭا نُّخْرِجُ مِنْهُ حَبًّۭا مُّتَرَاكِبًۭا وَمِنَ ٱلنَّخْلِ مِن طَلْعِهَا قِنْوَانٌۭ دَانِيَةٌۭ وَجَنَّٰتٍۢ مِّنْ أَعْنَابٍۢ وَٱلزَّيْتُونَ وَٱلرُّمَّانَ مُشْتَبِهًۭا وَغَيْرَ مُتَشَٰبِهٍ ۗ ٱنظُرُوٓا۟ إِلَىٰ ثَمَرِهِۦٓ إِذَآ أَثْمَرَ وَيَنْعِهِۦٓ ۚ إِنَّ فِى ذَٰلِكُمْ لَءَايَٰتٍۢ لِّقَوْمٍۢ يُؤْمِنُونَ
23,"That is Allah—your Lord! There is no god ˹worthy of worship˺ except Him. ˹He is˺ the Creator of all things, so worship Him ˹alone˺. And He is the Maintainer of everything.",6:102,6,102,"[""order_and_design""]","[""pairing_zaug""]",,,"[""contrasting the Dual Nature of Creation with the Singular Nature of the Creator""]",,TAAK_1_6_102,"[""prophetic_scientific"",""ethical_theological""]",ذَٰلِكُمُ ٱللَّهُ رَبُّكُمْ ۖ لَآ إِلَٰهَ إِلَّا هُوَ ۖ خَٰلِقُ كُلِّ شَىْءٍۢ فَٱعْبُدُوهُ ۚ وَهُوَ عَلَىٰ كُلِّ شَىْءٍۢ وَكِيلٌۭ
24,"Whoever Allah wills to guide, He opens their heart to Islam. But whoever He wills to leave astray, He makes their chest tight and constricted as if they were climbing up into the sky. This is how Allah dooms those who disbelieve.",6:125,6,125,"[""biological"",""geological"",""cosmological""]","[""physiology"",""atmospheric_phenomena"",""space_earth_interaction""]",,,,,TAAK_1_6_125,"[""phenomena"",""process"",""prophetic_scientific"",""ethical_theological""]",فَمَن يُرِدِ ٱللَّهُ أَن يَهْدِيَهُۥ يَشْرَحْ صَدْرَهُۥ لِلْإِسْلَٰمِ ۖ وَمَن يُرِدْ أَن يُضِلَّهُۥ يَجْعَلْ صَدْرَهُۥ ضَيِّقًا حَرَجًۭا كَأَنَّمَا يَصَّعَّدُ فِى ٱلسَّمَآءِ ۚ كَذَٰلِكَ يَجْعَلُ ٱللَّهُ ٱلرِّجْسَ عَلَى ٱلَّذِينَ لَا يُؤْمِنُونَ
25,"Indeed your Lord is Allah Who created the heavens and the earth in six Days, then established Himself on the Throne. He makes the day and night overlap in rapid succession. He created the sun, the moon, and the stars—all subjected by His command. The creation and the command belong to Him ˹alone˺. Blessed is Allah—Lord of all worlds!",7:54,7,54,"[""physical"",""cosmological""]","[""time_related"",""astronomy_celestial"",""day_night_cycles""]",,,"[""Creation in six days"",""Roundness of Earth""]",,TAAK_1_7_54,"[""creation_story"",""prophetic_scientific""]",إِنَّ رَبَّكُمُ ٱللَّهُ ٱلَّذِى خَلَقَ ٱلسَّمَٰوَٰتِ وَٱلْأَرْضَ فِى سِتَّةِ أَيَّامٍۢ ثُمَّ ٱسْتَوَىٰ عَلَى ٱلْعَرْشِ يُغْشِى ٱلَّيْلَ ٱلنَّهَارَ يَطْلُبُهُۥ حَثِيثًۭا وَٱلشَّمْسَ وَٱلْقَمَرَ وَٱلنُّجُومَ مُسَخَّرَٰتٍۭ بِأَمْرِهِۦٓ ۗ أَلَا لَهُ ٱلْخَلْقُ وَٱلْأَمْرُ ۗ تَبَارَكَ ٱللَّهُ رَبُّ ٱلْعَٰلَمِينَ
26,"He is the One Who sends the winds ushering in His mercy. When they bear heavy clouds, We drive them to a lifeless land and then cause rain to fall, producing every type of fruit. Similarly, We will bring the dead to life, so perhaps you will be mindful.",7:57,7,57,"[""biological"",""geological""]","[""plant_life_agriculture"",""hydrology_water_cycle"",""winds_movement"",""environmental_renewal_erosion"",""atmospheric_phenomena""]",,,,,TAAK_1_7_57,"[""process"",""prophetic_scientific""]",وَهُوَ ٱلَّذِى يُرْسِلُ ٱلرِّيَٰحَ بُشْرًۢا بَيْنَ يَدَىْ رَحْمَتِهِۦ ۖ حَتَّىٰٓ إِذَآ أَقَلَّتْ سَحَابًۭا ثِقَالًۭا سُقْنَٰهُ لِبَلَدٍۢ مَّيِّتٍۢ فَأَنزَلْنَا بِهِ ٱلْمَآءَ فَأَخْرَجْنَا بِهِۦ مِن كُلِّ ٱلثَّمَرَٰتِ ۚ كَذَٰلِكَ نُخْرِجُ ٱلْمَوْتَىٰ لَعَلَّكُمْ تَذَكَّرُونَ
27,"So We plagued them with floods, locusts, lice, frogs, and blood—all as clear signs, but they persisted in arrogance and were a wicked people.",7:133,7,133,"[""non_scientific""]","[""historical_event""]",,,"[""Punishments on Pharaoh and his people""]",,TAAK_1_7_133,"[""phenomena"",""historical_event""]",فَأَرْسَلْنَا عَلَيْهِمُ ٱلطُّوفَانَ وَٱلْجَرَادَ وَٱلْقُمَّلَ وَٱلضَّفَادِعَ وَٱلدَّمَ ءَايَٰتٍۢ مُّفَصَّلَٰتٍۢ فَٱسْتَكْبَرُوا۟ وَكَانُوا۟ قَوْمًۭا مُّجْرِمِينَ
28,"If We had willed, We would have elevated him with Our signs, but he clung to this life—following his evil desires. His example is that of a dog: if you chase it away, it pants, and if you leave it, it ˹still˺ pants. This is the example of the people who deny Our signs. So narrate ˹to them˺ stories ˹of the past˺, so perhaps they will reflect.",7:176,7,176,"[""biological""]","[""animal_behavior_ecosystems"",""physiology""]",,,,,TAAK_1_7_176,"[""signs_to_reflect_upon"",""phenomena"",""prophetic_scientific"",""parable""]",وَلَوْ شِئْنَا لَرَفَعْنَٰهُ بِهَا وَلَٰكِنَّهُۥٓ أَخْلَدَ إِلَى ٱلْأَرْضِ وَٱتَّبَعَ هَوَىٰهُ ۚ فَمَثَلُهُۥ كَمَثَلِ ٱلْكَلْبِ إِن تَحْمِلْ عَلَيْهِ يَلْهَثْ أَوْ تَتْرُكْهُ يَلْهَث ۚ ذَّٰلِكَ مَثَلُ ٱلْقَوْمِ ٱلَّذِينَ كَذَّبُوا۟ بِـَٔايَٰتِنَا ۚ فَٱقْصُصِ ٱلْقَصَصَ لَعَلَّهُمْ يَتَفَكَّرُونَ
29,"Indeed, the number of months ordained by Allah is twelve—in Allah’s Record since the day He created the heavens and the earth—of which four are sacred. That is the Right Way. So do not wrong one another during these months. And together fight the polytheists as they fight against you together. And know that Allah is with those mindful ˹of Him˺.",9:36,9,36,"[""physical"",""cosmological"",""order_and_design""]","[""time_related"",""celestial_bodies_movement"",""mizan""]",,,,,TAAK_1_9_36,"[""creation_story"",""numeric_emphasis"",""rotation_of_bodies""]",إِنَّ عِدَّةَ ٱلشُّهُورِ عِندَ ٱللَّهِ ٱثْنَا عَشَرَ شَهْرًۭا فِى كِتَٰبِ ٱللَّهِ يَوْمَ خَلَقَ ٱلسَّمَٰوَٰتِ وَٱلْأَرْضَ مِنْهَآ أَرْبَعَةٌ حُرُمٌۭ ۚ ذَٰلِكَ ٱلدِّينُ ٱلْقَيِّمُ ۚ فَلَا تَظْلِمُوا۟ فِيهِنَّ أَنفُسَكُمْ ۚ وَقَٰتِلُوا۟ ٱلْمُشْرِكِينَ كَآفَّةًۭ كَمَا يُقَٰتِلُونَكُمْ كَآفَّةًۭ ۚ وَٱعْلَمُوٓا۟ أَنَّ ٱللَّهَ مَعَ ٱلْمُتَّقِينَ
