id,hasTranslation,surah_ayah,surah_no,ayah_no,hasBroadCategories,hasScientificTopics,hasContextualReference,hasScientificConceptID,hasScientificTafsirTopics,hasScientificNodes,hasTafsirID,hasThemes,hasText
104,"Allah is the Creator of all things, and He is the Maintainer of everything.",39:62,39,62,"[""non_scientific""]","[""historical_event"",""thinking_reflecting""]",,,"[""Theological"",""Causality of Creation""]",,TAAK_3_39_62,"[""creation_story"",""historical_event"",""ethical_theological""]",ٱللَّهُ خَٰلِقُ كُلِّ شَىْءٍۢ ۖ وَهُوَ عَلَىٰ كُلِّ شَىْءٍۢ وَكِيلٌۭ
105,"It is Allah Who made the earth a place of settlement for you and the sky a canopy. He shaped you ˹in the womb˺, perfecting your form. And He has provided you with what is good and lawful. That is Allah—your Lord. So Blessed is Allah, Lord of all worlds.",40:64,40,64,"[""biological"",""geological""]","[""embryology_development"",""landforms""]",,,"[""Stability of Earth""]",,TAAK_3_40_64,"[""phenomena""]",ٱللَّهُ ٱلَّذِى جَعَلَ لَكُمُ ٱلْأَرْضَ قَرَارًۭا وَٱلسَّمَآءَ بِنَآءًۭ وَصَوَّرَكُمْ فَأَحْسَنَ صُوَرَكُمْ وَرَزَقَكُم مِّنَ ٱلطَّيِّبَٰتِ ۚ ذَٰلِكُمُ ٱللَّهُ رَبُّكُمْ ۖ فَتَبَارَكَ ٱللَّهُ رَبُّ ٱلْعَٰلَمِينَ
106,"He placed on the earth firm mountains, standing high, showered His blessings upon it, and ordained ˹all˺ its means of sustenance—totaling four Days exactly—for all who ask.",41:10,41,10,"[""geological""]","[""earth_layers""]",,,"[""Four Stages of Sustenance"",""Earth Characteristics""]",,TAAK_3_41_10,"[""creation_story"",""numeric_emphasis""]",وَجَعَلَ فِيهَا رَوَٰسِىَ مِن فَوْقِهَا وَبَٰرَكَ فِيهَا وَقَدَّرَ فِيهَآ أَقْوَٰتَهَا فِىٓ أَرْبَعَةِ أَيَّامٍۢ سَوَآءًۭ لِّلسَّآئِلِينَ
107,"Among His signs are the day and the night, the sun and the moon. Do not prostrate to the sun or the moon, but prostrate to Allah, Who created them ˹all˺, if you ˹truly˺ worship Him ˹alone˺.",41:37,41,37,"[""cosmological""]","[""astronomy_celestial"",""space_earth_interaction"",""celestial_bodies_movement"",""day_night_cycles""]",,,"[""Seasons and Time relation with sun and moon""]",,TAAK_3_41_37,"[""signs_to_reflect_upon"",""rotation_of_bodies""]",وَمِنْ ءَايَٰتِهِ ٱلَّيْلُ وَٱلنَّهَارُ وَٱلشَّمْسُ وَٱلْقَمَرُ ۚ لَا تَسْجُدُوا۟ لِلشَّمْسِ وَلَا لِلْقَمَرِ وَٱسْجُدُوا۟ لِلَّهِ ٱلَّذِى خَلَقَهُنَّ إِن كُنتُمْ إِيَّاهُ تَعْبُدُونَ
108,"To Allah ˹alone˺ belongs the kingdom of the heavens and the earth. He creates whatever He wills. He blesses whoever He wills with daughters, and blesses whoever He wills with sons,",42:49,42,49,"[""biological""]","[""reproduction_heredity""]","[""50""]",,"[""Male/Female Genitics""]",,TAAK_3_42_49-50,"[""process""]",لِّلَّهِ مُلْكُ ٱلسَّمَٰوَٰتِ وَٱلْأَرْضِ ۚ يَخْلُقُ مَا يَشَآءُ ۚ يَهَبُ لِمَن يَشَآءُ إِنَٰثًۭا وَيَهَبُ لِمَن يَشَآءُ ٱلذُّكُورَ
109,"or grants both, sons and daughters, ˹to whoever He wills˺, and leaves whoever He wills infertile. He is indeed All-Knowing, Most Capable.",42:50,42,50,"[""biological""]","[""reproduction_heredity""]",,,"[""Male/Female Genitics""]",,TAAK_3_42_49-50,"[""process""]",أَوْ يُزَوِّجُهُمْ ذُكْرَانًۭا وَإِنَٰثًۭا ۖ وَيَجْعَلُ مَن يَشَآءُ عَقِيمًا ۚ إِنَّهُۥ عَلِيمٌۭ قَدِيرٌۭ
110,These are Allah’s revelations which We recite to you ˹O Prophet˺ in truth. So what message will they believe in after ˹denying˺ Allah and His revelations?,45:6,45,6,"[""geological"",""order_and_design""]","[""winds_movement"",""atmospheric_phenomena""]",,,"[""Precision in Wind Patterns""]",,TAAK_3_45_6,"[""phenomena""]",تِلْكَ ءَايَٰتُ ٱللَّهِ نَتْلُوهَا عَلَيْكَ بِٱلْحَقِّ ۖ فَبِأَىِّ حَدِيثٍۭ بَعْدَ ٱللَّهِ وَءَايَٰتِهِۦ يُؤْمِنُونَ
111,"We have commanded people to honour their parents. Their mothers bore them in hardship and delivered them in hardship. Their ˹period of˺ bearing and weaning is thirty months. In time, when the child reaches their prime at the age of forty, they pray, “My Lord! Inspire me to ˹always˺ be thankful for Your favours which You blessed me and my parents with, and to do good deeds that please You. And instil righteousness in my offspring. I truly repent to You, and I truly submit ˹to Your Will˺.”",46:15,46,15,"[""biological""]","[""physiology"",""health""]",,,"[""Gestation and Weaning Math"",""Minimum duration pregnancy""]",,TAAK_3_46_15,"[""numeric_emphasis""]",وَوَصَّيْنَا ٱلْإِنسَٰنَ بِوَٰلِدَيْهِ إِحْسَٰنًا ۖ حَمَلَتْهُ أُمُّهُۥ كُرْهًۭا وَوَضَعَتْهُ كُرْهًۭا ۖ وَحَمْلُهُۥ وَفِصَٰلُهُۥ ثَلَٰثُونَ شَهْرًا ۚ حَتَّىٰٓ إِذَا بَلَغَ أَشُدَّهُۥ وَبَلَغَ أَرْبَعِينَ سَنَةًۭ قَالَ رَبِّ أَوْزِعْنِىٓ أَنْ أَشْكُرَ نِعْمَتَكَ ٱلَّتِىٓ أَنْعَمْتَ عَلَىَّ وَعَلَىٰ وَٰلِدَىَّ وَأَنْ أَعْمَلَ صَٰلِحًۭا تَرْضَىٰهُ وَأَصْلِحْ لِى فِى ذُرِّيَّتِىٓ ۖ إِنِّى تُبْتُ إِلَيْكَ وَإِنِّى مِنَ ٱلْمُسْلِمِينَ
112,"Muhammad is the Messenger of Allah. And those with him are firm with the disbelievers To those of them who believe and do good, Allah has promised forgiveness and a great reward.",48:29,48,29,"[""biological""]","[""plant_life_agriculture"",""reproduction_heredity""]",,,"[""Plant Suckers""]",,TAAK_3_48_29,"[""prophetic_scientific"",""parable""]",مُّحَمَّدٌۭ رَّسُولُ ٱللَّهِ ۚ وَٱلَّذِينَ مَعَهُۥٓ أَشِدَّآءُ عَلَى ٱلْكُفَّارِ رُحَمَآءُ بَيْنَهُمْ ۖ تَرَىٰهُمْ رُكَّعًۭا سُجَّدًۭا يَبْتَغُونَ فَضْلًۭا مِّنَ ٱللَّهِ وَرِضْوَٰنًۭا ۖ سِيمَاهُمْ فِى وُجُوهِهِم مِّنْ أَثَرِ ٱلسُّجُودِ ۚ ذَٰلِكَ مَثَلُهُمْ فِى ٱلتَّوْرَىٰةِ ۚ وَمَثَلُهُمْ فِى ٱلْإِنجِيلِ كَزَرْعٍ أَخْرَجَ شَطْـَٔهُۥ فَـَٔازَرَهُۥ فَٱسْتَغْلَظَ فَٱسْتَوَىٰ عَلَىٰ سُوقِهِۦ يُعْجِبُ ٱلزُّرَّاعَ لِيَغِيظَ بِهِمُ ٱلْكُفَّارَ ۗ وَعَدَ ٱللَّهُ ٱلَّذِينَ ءَامَنُوا۟ وَعَمِلُوا۟ ٱلصَّٰلِحَٰتِ مِنْهُم مَّغْفِرَةًۭ وَأَجْرًا عَظِيمًۢا
113,"We certainly know what the earth consumes of them ˹after their death˺, and with us is a well-preserved Record.",50:4,50,4,"[""biological""]","[""physiology""]",,,"[""Decomposition and the Tailbone"",""Coccyx persistence"",""Indestructible part of the body""]",,TAAK_3_50_4,"[""prophetic_scientific"",""Eschatology""]",قَدْ عَلِمْنَا مَا تَنقُصُ ٱلْأَرْضُ مِنْهُمْ ۖ وَعِندَنَا كِتَٰبٌ حَفِيظٌۢ
114,"Have they not then looked at the sky above them: how We built it and adorned it ˹with stars˺, leaving it flawless?",50:6,50,6,"[""cosmological""]","[""astronomy_celestial"",""heavens_chracteristics""]",,,,,TAAK_3_50_6,"[""invitation_to_observe"",""design""]",أَفَلَمْ يَنظُرُوٓا۟ إِلَى ٱلسَّمَآءِ فَوْقَهُمْ كَيْفَ بَنَيْنَٰهَا وَزَيَّنَّٰهَا وَمَا لَهَا مِن فُرُوجٍۢ
115,"and towering palm trees ˹loaded˺ with clustered fruit,",50:10,50,10,"[""biological""]","[""animal_behavior_ecosystems"",""plant_life_agriculture""]",,,"[""Biological marvel of the Palm""]",,TAAK_3_50_10,"[""design""]",وَٱلنَّخْلَ بَاسِقَٰتٍۢ لَّهَا طَلْعٌۭ نَّضِيدٌۭ
116,˹And˺ by the heavens in their marvellous design!,51:7,51,7,"[""cosmological""]","[""astronomy_celestial"",""heavens_chracteristics""]",,,"[""The Weaving of the Sky""]",,TAAK_3_51_7,"[""phenomena"",""design""]",وَٱلسَّمَآءِ ذَاتِ ٱلْحُبُكِ
117,In heaven is your sustenance and whatever you are promised.,51:22,51,22,"[""geological"",""cosmological""]","[""hydrology_water_cycle"",""space_earth_interaction""]",,,"[""Sources of sustenance from the sky""]",,TAAK_3_51_22,"[""phenomena""]",وَفِى ٱلسَّمَآءِ رِزْقُكُمْ وَمَا تُوعَدُونَ
118,"We built the universe with ˹great˺ might, and We are certainly expanding ˹it˺.",51:47,51,47,"[""cosmological""]","[""big_bang"",""universe_expansion""]",,"[""BigBang_COSMOS_EXPANSION""]",,"[""BigBang_CosmosExpansion_06""]",TAAK_3_51_47,"[""creation_story"",""prophetic_scientific""]",وَٱلسَّمَآءَ بَنَيْنَٰهَا بِأَيْي۟دٍۢ وَإِنَّا لَمُوسِعُونَ
119,"As for the earth, We spread it out. How superbly did We smooth it out!",51:48,51,48,"[""biological"",""geological""]","[""landforms""]",,,"[""Earth Smoothing""]",,TAAK_3_51_48,"[""creation_story"",""process""]",وَٱلْأَرْضَ فَرَشْنَٰهَا فَنِعْمَ ٱلْمَٰهِدُونَ
120,And We created pairs of all things so perhaps you would be mindful.,51:49,51,49,"[""order_and_design""]","[""pairing_zaug""]",,,"[""Creation in pairs"",""Pairs in living and non-living""]",,TAAK_3_51_49,"[""creation_story""]",وَمِن كُلِّ شَىْءٍ خَلَقْنَا زَوْجَيْنِ لَعَلَّكُمْ تَذَكَّرُونَ
121,And by the seas set on fire!,52:6,52,6,"[""geological""]","[""earthquakes_surface_change"",""oceanography""]",,,"[""Submarine Volcanism""]",,TAAK_3_52_6,"[""phenomena"",""prophetic_scientific""]",وَٱلْبَحْرِ ٱلْمَسْجُورِ
122,"those who avoid major sins and shameful deeds, despite ˹stumbling on˺ minor sins. Surely your Lord is infinite in forgiveness. He knew well what would become of you as He created you from the earth So do not ˹falsely˺ elevate yourselves. He knows best who is ˹truly˺ righteous.",53:32,53,32,"[""biological""]","[""human_development""]",,"[""EMBRYO""]","[""Origin of Mankind from earth""]",,TAAK__53_32,"[""creation_story"",""prophetic_scientific"",""ethical_theological""]",ٱلَّذِينَ يَجْتَنِبُونَ كَبَٰٓئِرَ ٱلْإِثْمِ وَٱلْفَوَٰحِشَ إِلَّا ٱللَّمَمَ ۚ إِنَّ رَبَّكَ وَٰسِعُ ٱلْمَغْفِرَةِ ۚ هُوَ أَعْلَمُ بِكُمْ إِذْ أَنشَأَكُم مِّنَ ٱلْأَرْضِ وَإِذْ أَنتُمْ أَجِنَّةٌۭ فِى بُطُونِ أُمَّهَٰتِكُمْ ۖ فَلَا تُزَكُّوٓا۟ أَنفُسَكُمْ ۖ هُوَ أَعْلَمُ بِمَنِ ٱتَّقَىٰٓ
123,And He created the pairs—males and females—,53:45,53,45,"[""biological""]","[""reproduction_heredity""]",,"[""EMBRYO""]",,"[""EMBRYO_10""]",TAAK_3_53_45,"[""prophetic_scientific""]",وَأَنَّهُۥ خَلَقَ ٱلزَّوْجَيْنِ ٱلذَّكَرَ وَٱلْأُنثَىٰ
124,from a sperm-drop when it is emitted.,53:46,53,46,"[""biological""]","[""reproduction_heredity""]",,"[""EMBRYO""]",,"[""EMBRYO_1"",""EMBRYO_9""]",TAAK_3_53_46,"[""prophetic_scientific""]",مِن نُّطْفَةٍ إِذَا تُمْنَىٰ
125,The Hour has drawn near and the moon was split ˹in two˺.,54:1,54,1,"[""cosmological""]","[""astronomy_celestial""]",,,"[""Lunar Riles"",""Splitting Moon"",""Lines on Moon as Evidence of Splitting""]",,TAAK_3_54_1,"[""historical_event"",""eschatology""]",ٱقْتَرَبَتِ ٱلسَّاعَةُ وَٱنشَقَّ ٱلْقَمَرُ
126,"With eyes downcast, they will come forth from the graves as if they were swarming locusts,",54:7,54,7,"[""biological""]","[""animal_behavior_ecosystems"",""entomology""]",,,"[""Waking from grave like Locusts""]",,TAAK_3_54_7,"[""metaphorical"",""eschatology""]",خُشَّعًا أَبْصَٰرُهُمْ يَخْرُجُونَ مِنَ ٱلْأَجْدَاثِ كَأَنَّهُمْ جَرَادٌۭ مُّنتَشِرٌۭ
127,"Indeed, We have created everything, perfectly preordained.",54:49,54,49,"[""order_and_design""]","[""qadar""]",,,"[""Qadar in micro-scales"",""Determination(Qadar) in everything""]",,TAAK_3_54_49,"[""creation_story"",""Divine Measure""]",إِنَّا كُلَّ شَىْءٍ خَلَقْنَٰهُ بِقَدَرٍۢ
128,"He merges the two bodies of ˹fresh and salt˺ water,",55:19,55,19,"[""geological""]","[""oceanography""]","[""20""]","[""ESTUARY""]","[""Barrier between fresh and salty water"",""Mediterranean"",""Red Sea""]","[""ESTUARY_09"",""ESTUARY_15"",""ESTUARY_11""]",TAAK_4_55_19-20,"[""phenomena"",""prophetic_scientific""]",مَرَجَ ٱلْبَحْرَيْنِ يَلْتَقِيَانِ
129,yet between them is a barrier they never cross.,55:20,55,20,"[""geological""]","[""oceanography""]",,"[""ESTUARY""]","[""Barrier between fresh and salty water"",""Mediterranean"",""Red Sea""]","[""ESTUARY_01"",""ESTUARY_06""]",TAAK_4_55_19-20,"[""phenomena"",""prophetic_scientific""]",بَيْنَهُمَا بَرْزَخٌۭ لَّا يَبْغِيَانِ
130,"O  assembly of jinn and humans! If you can penetrate beyond the realms of the heavens and the earth, then do so. ˹But˺ you cannot do that without ˹Our˺ authority.",55:33,55,33,"[""cosmological""]","[""space_earth_interaction""]",,,"[""Escaping Earth's Zones""]",,TAAK_4_55_33,"[""phenomena"",""challenge""]",يَٰمَعْشَرَ ٱلْجِنِّ وَٱلْإِنسِ إِنِ ٱسْتَطَعْتُمْ أَن تَنفُذُوا۟ مِنْ أَقْطَارِ ٱلسَّمَٰوَٰتِ وَٱلْأَرْضِ فَٱنفُذُوا۟ ۚ لَا تَنفُذُونَ إِلَّا بِسُلْطَٰنٍۢ
131,Have you considered what you ejaculate?,56:58,56,58,"[""biological""]","[""physiology""]",,,"[""Cell Division""]",,TAAK_4_56_58,"[""signs_to_reflect_upon"",""skeptical_questioning""]",أَفَرَءَيْتُم مَّا تُمْنُونَ
132,"We have ordained death for ˹all of˺ you, and We cannot be prevented",56:60,56,60,"[""biological""]","[""physiology"",""reproduction_heredity""]",,,"[""Telomeres and Cellular Death""]",,TAAK_4_56_60,"[""divine_measure""]",نَحْنُ قَدَّرْنَا بَيْنَكُمُ ٱلْمَوْتَ وَمَا نَحْنُ بِمَسْبُوقِينَ
133,Have you considered the water you drink?,56:68,56,68,"[""geological""]","[""hydrology_water_cycle"",""atmospheric_phenomena""]","[""69"",""70""]","[""HYDRO_METEO""]","[""Fresh/Sweet water as rain""]",,TAAK_4_56_68-70,"[""signs_to_reflect_upon"",""process"",""invitation_to_observe""]",أَفَرَءَيْتُمُ ٱلْمَآءَ ٱلَّذِى تَشْرَبُونَ
134,"Is it you who bring it down from the clouds, or is it We Who do so?",56:69,56,69,"[""geological""]","[""hydrology_water_cycle"",""atmospheric_phenomena""]",,"[""HYDRO_METEO""]","[""Fresh/Sweet water as rain""]",,TAAK_4_56_68-70,"[""signs_to_reflect_upon"",""process"",""invitation_to_observe""]",ءَأَنتُمْ أَنزَلْتُمُوهُ مِنَ ٱلْمُزْنِ أَمْ نَحْنُ ٱلْمُنزِلُونَ
135,"If We willed, We could make it salty. Will you not then give thanks?",56:70,56,70,"[""geological""]","[""hydrology_water_cycle"",""atmospheric_phenomena""]",,,"[""Fresh/Sweet water as rain""]",,TAAK_4_56_68-70,"[""signs_to_reflect_upon"",""process"",""invitation_to_observe""]",لَوْ نَشَآءُ جَعَلْنَٰهُ أُجَاجًۭا فَلَوْلَا تَشْكُرُونَ
136,Have you considered the fire you kindle?,56:71,56,71,"[""biological"",""physical""]","[""plant_life_agriculture"",""energy_radiation""]",,,"[""Plants as Fuel""]",,TAAK_4_56_71,"[""signs_to_reflect_upon"",""process"",""invitation_to_observe""]",أَفَرَءَيْتُمُ ٱلنَّارَ ٱلَّتِى تُورُونَ
137,So I do swear by the positions of the stars—,56:75,56,75,"[""cosmological""]","[""astronomy_celestial""]","[""76""]",,"[""Relative positions of stars"",""Vast differences between stars""]",,TAAK_4_56_75-76,"[""signs_to_reflect_upon"",""phenomena"",""Oath""]",۞ فَلَآ أُقْسِمُ بِمَوَٰقِعِ ٱلنُّجُومِ
138,"and this, if only you knew, is indeed a great oath—",56:76,56,76,"[""cosmological""]","[""astronomy_celestial""]",,,"[""Relative positions of stars"",""Vast differences between stars""]",,TAAK_4_56_75-76,"[""signs_to_reflect_upon"",""phenomena"",""Oath""]",وَإِنَّهُۥ لَقَسَمٌۭ لَّوْ تَعْلَمُونَ عَظِيمٌ
139,"Indeed, We sent Our messengers with clear proofs, and with them We sent down the Scripture and the balance ˹of justice˺ so that people may administer justice. And We sent down iron with its great might, benefits for humanity, and means for Allah to prove who ˹is willing to˺ stand up for Him and His messengers without seeing Him. Surely Allah is All-Powerful, Almighty.",57:25,57,25,"[""geological"",""cosmological""]","[""minerals_metals"",""space_earth_interaction""]",,,"[""Cosmic Origin of Iron""]",,TAAK_4_57_25,"[""prophetic_scientific"",""ethical_theological"",""material_substance_reference"",""benifits_of_something""]",لَقَدْ أَرْسَلْنَا رُسُلَنَا بِٱلْبَيِّنَٰتِ وَأَنزَلْنَا مَعَهُمُ ٱلْكِتَٰبَ وَٱلْمِيزَانَ لِيَقُومَ ٱلنَّاسُ بِٱلْقِسْطِ ۖ وَأَنزَلْنَا ٱلْحَدِيدَ فِيهِ بَأْسٌۭ شَدِيدٌۭ وَمَنَٰفِعُ لِلنَّاسِ وَلِيَعْلَمَ ٱللَّهُ مَن يَنصُرُهُۥ وَرُسُلَهُۥ بِٱلْغَيْبِ ۚ إِنَّ ٱللَّهَ قَوِىٌّ عَزِيزٌۭ
140,"Allah is the One Who created seven heavens ˹in layers˺, and likewise for the earth. The ˹divine˺ command descends between them so you may know that Allah is Most Capable of everything and that Allah certainly encompasses all things in ˹His˺ knowledge.",65:12,65,12,"[""geological""]","[""earth_layers""]",,,"[""Internal Structure of Earth""]",,TAAK_4_65_12,"[""numeric_emphasis"",""knowledge_understanding""]",ٱللَّهُ ٱلَّذِى خَلَقَ سَبْعَ سَمَٰوَٰتٍۢ وَمِنَ ٱلْأَرْضِ مِثْلَهُنَّ يَتَنَزَّلُ ٱلْأَمْرُ بَيْنَهُنَّ لِتَعْلَمُوٓا۟ أَنَّ ٱللَّهَ عَلَىٰ كُلِّ شَىْءٍۢ قَدِيرٌۭ وَأَنَّ ٱللَّهَ قَدْ أَحَاطَ بِكُلِّ شَىْءٍ عِلْمًۢا
141,"Have they not seen the birds above them, spreading and folding their wings? None holds them up except the Most Compassionate. Indeed, He is All-Seeing of everything.",67:19,67,19,"[""biological"",""physical""]","[""animal_behavior_ecosystems""]",,,"[""Flying Mechanics of Birds"",""Aerodynamics""]",,TAAK_4_67_19,"[""phenomena"",""skeptical_questioning"",""invitation_to_observe""]",أَوَلَمْ يَرَوْا۟ إِلَى ٱلطَّيْرِ فَوْقَهُمْ صَٰٓفَّٰتٍۢ وَيَقْبِضْنَ ۚ مَا يُمْسِكُهُنَّ إِلَّا ٱلرَّحْمَٰنُ ۚ إِنَّهُۥ بِكُلِّ شَىْءٍۭ بَصِيرٌ
142,"Indeed, when the floodwater had overflowed, We carried you in the floating Ark ˹with Noah˺,",69:11,69,11,"[""biological"",""geological""]","[""oceanography""]",,,"[""Mount Judi"",""Location of Noah's Ark"",""Human genetics"",""Second human wave""]",,TAAK_4_69_11,"[""historical_event""]",إِنَّا لَمَّا طَغَا ٱلْمَآءُ حَمَلْنَٰكُمْ فِى ٱلْجَارِيَةِ
143,"Now, I do swear by whatever you see,",69:38,69,38,"[""biological"",""physical""]","[""physiology""]","[""39""]",,"[""Visible and Invisible Realms"",""Empirical Observation"",""Microbiology""]",,TAAK_4_69_38-39,"[""signs_to_reflect_upon"",""prophetic_scientific"",""oath""]",فَلَآ أُقْسِمُ بِمَا تُبْصِرُونَ
144,and whatever you cannot see!,69:39,69,39,"[""biological"",""physical""]","[""physiology""]",,,,,TAAK_4_69_38-39,"[""signs_to_reflect_upon"",""prophetic_scientific"",""oath""]",وَمَا لَا تُبْصِرُونَ
145,"So, I do swear by the Lord of ˹all˺ the points of sunrise and sunset that We are truly capable",70:40,70,40,"[""geological"",""cosmological""]","[""astronomy_celestial"",""day_night_cycles""]",,,"[""Orbital Mechanics""]",,TAAK_4_70_40,"[""phenomena"",""rotation_of_bodies""]",فَلَآ أُقْسِمُ بِرَبِّ ٱلْمَشَٰرِقِ وَٱلْمَغَٰرِبِ إِنَّا لَقَٰدِرُونَ
146,"What is the matter with you that you are not in awe of the Majesty of Allah,",71:13,71,13,"[""biological"",""order_and_design""]","[""physiology""]","[""14""]",,"[""Cellular Complexity"",""Genetics""]",,TAAK_4_71_13-14,"[""ethical_theological"",""design""]",مَّا لَكُمْ لَا تَرْجُونَ لِلَّهِ وَقَارًۭا
147,when He truly created you in stages ˹of development˺?,71:14,71,14,"[""biological"",""order_and_design""]","[""physiology""]",,"[""EMBRYO""]","[""Cellular Complexity"",""Genetics""]",,TAAK_4_71_13-14,"[""ethical_theological"",""design""]",وَقَدْ خَلَقَكُمْ أَطْوَارًا
148,Yes ˹indeed˺! We are ˹most˺ capable of restoring ˹even˺ their very fingertips.,75:4,75,4,"[""biological""]","[""physiology""]",,,"[""Unique Design of Fingertips"",""Reconstruction of Fingertips""]",,TAAK_4_75_4,"[""prophetic_scientific""]",بَلَىٰ قَٰدِرِينَ عَلَىٰٓ أَن نُّسَوِّىَ بَنَانَهُۥ
149,Is there not a period of time when each human is nothing yet worth mentioning?,76:1,76,1,"[""physical"",""cosmological""]","[""time_related"",""cosmology_universe""]",,,"[""Time universe and earth before Humanity""]",,TAAK_4_76_1,"[""ethical_theological"",""skeptical_questioning""]",هَلْ أَتَىٰ عَلَى ٱلْإِنسَٰنِ حِينٌۭ مِّنَ ٱلدَّهْرِ لَمْ يَكُن شَيْـًۭٔا مَّذْكُورًا
150,"˹For˺ indeed, We ˹alone˺ created humans from a drop of mixed fluids, ˹in order˺ to test them, so We made them hear and see.",76:2,76,2,"[""biological""]","[""embryology_development"",""human_development"",""reproduction_heredity""]",,"[""EMBRYO""]","[""Gamete Combination""]","[""EMBRYO_01"",""EMBRYO_02""]",TAAK_4_76_2,"[""creation_story"",""prophetic_scientific""]",إِنَّا خَلَقْنَا ٱلْإِنسَٰنَ مِن نُّطْفَةٍ أَمْشَاجٍۢ نَّبْتَلِيهِ فَجَعَلْنَٰهُ سَمِيعًۢا بَصِيرًا
151,"Did We not create you from a humble fluid,",77:20,77,20,"[""biological"",""order_and_design""]","[""physiology"",""qadar""]","[""21"",""22"",""23""]","[""EMBRYO""]","[""Despised Fluid"",""Anatomy"",""Humble Origin""]","[""EMBRYO_1""]",TAAK_4_77_20-23,"[""prophetic_scientific"",""design"",""process""]",أَلَمْ نَخْلُقكُّم مِّن مَّآءٍۢ مَّهِينٍۢ
152,placing it in a secure place,77:21,77,21,"[""biological"",""order_and_design""]","[""physiology"",""qadar""]",,"[""EMBRYO""]","[""Despised Fluid"",""Anatomy"",""Humble Origin""]","[""EMBRYO_4"",""EMBRYO_8""]",TAAK_4_77_20-23,"[""prophetic_scientific"",""design"",""process""]",فَجَعَلْنَٰهُ فِى قَرَارٍۢ مَّكِينٍ
153,until an appointed time?,77:22,77,22,"[""biological"",""order_and_design""]","[""physiology"",""qadar""]",,,"[""Despised Fluid"",""Anatomy"",""Humble Origin""]",,TAAK_4_77_20-23,"[""prophetic_scientific"",""design"",""process""]",إِلَىٰ قَدَرٍۢ مَّعْلُومٍۢ
154,We ˹perfectly˺ ordained ˹its development˺. How excellent are We in doing so!,77:23,77,23,"[""biological"",""order_and_design""]","[""physiology"",""qadar""]",,,"[""Despised Fluid"",""Anatomy"",""Humble Origin""]",,TAAK_4_77_20-23,"[""prophetic_scientific"",""design"",""process""]",فَقَدَرْنَا فَنِعْمَ ٱلْقَٰدِرُونَ
155,"Have We not smoothed out the earth ˹like a bed˺,",78:6,78,6,"[""geological""]","[""mountains_stability"",""earth_layers""]",,,"[""Mountains as Stakes""]",,TAAK_4_78_6,"[""creation_story"",""metaphorical""]",أَلَمْ نَجْعَلِ ٱلْأَرْضَ مِهَٰدًۭا
156,"and ˹made˺ the mountains as ˹its˺ pegs,",78:7,78,7,"[""geological""]","[""mountains_stability"",""earth_layers""]",,,"[""Mountains as Stakes"",""Mountains as pegs""]",,TAAK_4_78_7,"[""creation_story"",""metaphorical""]",وَٱلْجِبَالَ أَوْتَادًۭا
157,"and sent down from rainclouds pouring water,",78:14,78,14,"[""geological""]","[""hydrology_water_cycle"",""atmospheric_phenomena""]",,"[""HYDRO_METEO""]","[""Pressing Clouds""]","[""HYDRO_METEO_12"",""HYDRO_METEO_21""]",TAAK_4_78_14,"[""phenomena"",""process""]",وَأَنزَلْنَا مِنَ ٱلْمُعْصِرَٰتِ مَآءًۭ ثَجَّاجًۭا
